{
  "schema_version": 1,
  "plugin": "imps",
  "version": "0.1.0+g0123456789ab",
  "source_commit": "0123456789ab0123456789ab0123456789ab0123",
  "files": [
    {
      "path": "entry.md",
      "sha256": "aaaaaaaaaaaaaaaaaaaaaaaaaaaaaaaaaaaaaaaaaaaaaaaaaaaaaaaaaaaaaaaa",
      "mode": 420
    }
  ]
}
